{
  "skill_id": "acceptance-writing",
  "name": "Acceptance Writing",
  "description": "Write concise user-facing summaries",
  "category": "writing",
  "allowed_tools": [
    "write",
    "read"
  ],
  "input_schema": {
    "type": "object"
  },
  "output_contract": {
    "expected_artifacts": [
      "summary"
    ]
  },
  "tags": [
    "acceptance",
    "planner"
  ],
  "status": "active",
  "metadata": {
    "demo": "acceptance"
  },
  "created_at": "2026-06-07T17:04:37.832Z",
  "updated_at": "2026-06-07T17:04:37.832Z",
  "workspace_id": "default"
}
