{
  "skill_id": "competitive-research",
  "name": "Competitive Research",
  "description": "市场 调研 竞品 对比 分析 报告 现状 ，gather competitor and market context for analysis report",
  "category": "research",
  "allowed_tools": [
    "web",
    "read",
    "write"
  ],
  "input_schema": {
    "type": "object"
  },
  "output_contract": {
    "expected_artifacts": [
      "research-notes",
      "research-report"
    ]
  },
  "tags": [
    "research",
    "competitor",
    "analysis"
  ],
  "status": "active",
  "metadata": {
    "domain": "research"
  },
  "created_at": "2026-06-12T22:00:00.000Z",
  "updated_at": "2026-06-12T22:00:00.000Z",
  "workspace_id": "default"
}
